{
  "schemaVersion": 1,
  "rubricVersion": "story-quality-text-v2",
  "readerProfileVersion": "reader-profiles-v1",
  "evaluatorModel": "GPT-5",
  "artifact": {
    "path": "/Users/padmaja/Documents/kids-book-gen/output/stories/preschool-category-collection/nora-noticing-walk/story-03.json",
    "sha256": "9aa6b56b98772fe0c37e469bab2dd156f6bb94a1f899f032115162bed0b59785",
    "title": "Nora's Noticing Walk",
    "revision": 3,
    "unitCount": 12
  },
  "reader": {
    "age": 4,
    "ageBand": "ages_3_5",
    "readingMode": "parent_read_aloud"
  },
  "dimensions": [
    {
      "ruleId": "STRUCT-PROMISE-01",
      "result": "strong",
      "confidence": "high",
      "evidence": [
        {
          "unit": 1,
          "observation": "Spread 1: Nora drew four empty boxes in her notebook. \"One is for a blue butterfly,\" she said. \"The other three can surprise me.\" Mama and little cousin Jo came too."
        },
        {
          "unit": 2,
          "observation": "Spread 2: Along the garden path, Nora looked high and low. Red flower, yellow flower, white flower—but no blue butterfly. Can you point to something blue?"
        },
        {
          "unit": 3,
          "observation": "Spread 3: \"BIRD!\" shouted Jo. A sparrow fluttered from the fence. Nora frowned. \"Now we'll never see anything.\" Jo's shoulders drooped."
        }
      ],
      "observation": "Nora's four-box walk promise meets pressure when the expected butterfly is absent and her reaction hurts Jo.",
      "predictedReaderEffect": "Prediction: this feature is likely to support comprehension, participation, or emotional engagement for many age-four listeners; individual response may vary.",
      "revision": null,
      "preserve": [
        "Nora's four-box walk promise meets pressure when the expected butterfly is absent and her reaction hurts Jo."
      ]
    },
    {
      "ruleId": "STRUCT-GOAL-01",
      "result": "strong",
      "confidence": "high",
      "evidence": [
        {
          "unit": 1,
          "observation": "Spread 1: Nora drew four empty boxes in her notebook. \"One is for a blue butterfly,\" she said. \"The other three can surprise me.\" Mama and little cousin Jo came too."
        },
        {
          "unit": 2,
          "observation": "Spread 2: Along the garden path, Nora looked high and low. Red flower, yellow flower, white flower—but no blue butterfly. Can you point to something blue?"
        }
      ],
      "observation": "Filling four boxes, with one reserved for a blue butterfly, is immediate, visible, and emotionally specific.",
      "predictedReaderEffect": "Prediction: this feature is likely to support comprehension, participation, or emotional engagement for many age-four listeners; individual response may vary.",
      "revision": null,
      "preserve": [
        "Filling four boxes, with one reserved for a blue butterfly, is immediate, visible, and emotionally specific."
      ]
    },
    {
      "ruleId": "STRUCT-CAUSE-01",
      "result": "strong",
      "confidence": "high",
      "evidence": [
        {
          "unit": 3,
          "observation": "Spread 3: \"BIRD!\" shouted Jo. A sparrow fluttered from the fence. Nora frowned. \"Now we'll never see anything.\" Jo's shoulders drooped."
        },
        {
          "unit": 4,
          "observation": "Spread 4: Mama said, \"You hoped for a butterfly. Jo hoped to help. That's two big hopes.\" Nora's tight hands opened a little."
        },
        {
          "unit": 5,
          "observation": "Spread 5: The garden path curved toward the creek. Mama whispered, \"What can we notice without chasing or touching?\" Nora made up a rule: \"Eyes look, ears hear, gentle hands stay near.\""
        },
        {
          "unit": 7,
          "observation": "Spread 7: Scritch-scratch came from a fallen log beside the stone. A pill bug curled into a tiny gray ball when the log trembled. Nora and Jo stepped back. Soon it uncurled. Box two got a dotty circle."
        },
        {
          "unit": 8,
          "observation": "Spread 8: \"My turn to notice?\" Jo whispered. Nora remembered his droopy shoulders. She scooted over. \"Your turn.\" Together they said, \"Eyes look, ears hear, gentle hands stay near.\" Jo pointed—not too close—to three ants carrying crumbs."
        },
        {
          "unit": 10,
          "observation": "Spread 10: One box was still empty. \"What else can we notice?\" Nora asked Jo. The sky turned from bright to dim. A cool puff brushed their cheeks. Leaves flipped their pale undersides."
        },
        {
          "unit": 11,
          "observation": "Spread 11: \"Rain is coming!\" Jo said. Plink! One drop landed inside box four. Plink-plink! Nora laughed. \"The rain noticed my notebook!\" They hurried home together—no butterfly, but four true surprises."
        }
      ],
      "observation": "Jo's shout prompts conflict; Mama's framing helps Nora invent a new method; nearby sound, Jo's request, and Nora's final question explicitly bridge later discoveries.",
      "predictedReaderEffect": "Prediction: this feature is likely to support comprehension, participation, or emotional engagement for many age-four listeners; individual response may vary.",
      "revision": null,
      "preserve": [
        "Jo's shout prompts conflict; Mama's framing helps Nora invent a new method; nearby sound, Jo's request, and Nora's final question explicitly bridge later discoveries."
      ]
    },
    {
      "ruleId": "STRUCT-ESCALATION-01",
      "result": "strong",
      "confidence": "high",
      "evidence": [
        {
          "unit": 2,
          "observation": "Spread 2: Along the garden path, Nora looked high and low. Red flower, yellow flower, white flower—but no blue butterfly. Can you point to something blue?"
        },
        {
          "unit": 3,
          "observation": "Spread 3: \"BIRD!\" shouted Jo. A sparrow fluttered from the fence. Nora frowned. \"Now we'll never see anything.\" Jo's shoulders drooped."
        },
        {
          "unit": 8,
          "observation": "Spread 8: \"My turn to notice?\" Jo whispered. Nora remembered his droopy shoulders. She scooted over. \"Your turn.\" Together they said, \"Eyes look, ears hear, gentle hands stay near.\" Jo pointed—not too close—to three ants carrying crumbs."
        },
        {
          "unit": 10,
          "observation": "Spread 10: One box was still empty. \"What else can we notice?\" Nora asked Jo. The sky turned from bright to dim. A cool puff brushed their cheeks. Leaves flipped their pale undersides."
        }
      ],
      "observation": "An absent butterfly becomes relationship strain, then a repaired partnership faces one remaining box and approaching rain.",
      "predictedReaderEffect": "Prediction: this feature is likely to support comprehension, participation, or emotional engagement for many age-four listeners; individual response may vary.",
      "revision": null,
      "preserve": [
        "An absent butterfly becomes relationship strain, then a repaired partnership faces one remaining box and approaching rain."
      ]
    },
    {
      "ruleId": "STRUCT-CHOICE-01",
      "result": "strong",
      "confidence": "high",
      "evidence": [
        {
          "unit": 5,
          "observation": "Spread 5: The garden path curved toward the creek. Mama whispered, \"What can we notice without chasing or touching?\" Nora made up a rule: \"Eyes look, ears hear, gentle hands stay near.\""
        },
        {
          "unit": 8,
          "observation": "Spread 8: \"My turn to notice?\" Jo whispered. Nora remembered his droopy shoulders. She scooted over. \"Your turn.\" Together they said, \"Eyes look, ears hear, gentle hands stay near.\" Jo pointed—not too close—to three ants carrying crumbs."
        },
        {
          "unit": 10,
          "observation": "Spread 10: One box was still empty. \"What else can we notice?\" Nora asked Jo. The sky turned from bright to dim. A cool puff brushed their cheeks. Leaves flipped their pale undersides."
        }
      ],
      "observation": "Nora creates the safe rule, chooses to include Jo, and asks him to join the final search.",
      "predictedReaderEffect": "Prediction: this feature is likely to support comprehension, participation, or emotional engagement for many age-four listeners; individual response may vary.",
      "revision": null,
      "preserve": [
        "Nora creates the safe rule, chooses to include Jo, and asks him to join the final search."
      ]
    },
    {
      "ruleId": "STRUCT-RESOLUTION-01",
      "result": "strong",
      "confidence": "high",
      "evidence": [
        {
          "unit": 8,
          "observation": "Spread 8: \"My turn to notice?\" Jo whispered. Nora remembered his droopy shoulders. She scooted over. \"Your turn.\" Together they said, \"Eyes look, ears hear, gentle hands stay near.\" Jo pointed—not too close—to three ants carrying crumbs."
        },
        {
          "unit": 9,
          "observation": "Spread 9: The ants followed one another toward a crack in the path. Nora drew three dashes in box three. \"They found a way home,\" Jo said. Nora smiled at her noticing partner."
        },
        {
          "unit": 10,
          "observation": "Spread 10: One box was still empty. \"What else can we notice?\" Nora asked Jo. The sky turned from bright to dim. A cool puff brushed their cheeks. Leaves flipped their pale undersides."
        },
        {
          "unit": 11,
          "observation": "Spread 11: \"Rain is coming!\" Jo said. Plink! One drop landed inside box four. Plink-plink! Nora laughed. \"The rain noticed my notebook!\" They hurried home together—no butterfly, but four true surprises."
        }
      ],
      "observation": "Nora's choice to notice with Jo produces the third find and lets Jo read the weather signs that complete the notebook.",